{
  "id": "scene.greybrook.chapel_delivery",
  "scope": {
    "location": "location.chapel_yard"
  },
  "priority": 10,
  "conditions": [
    {
      "rule": "quest.stage_is",
      "args": ["quest.bread_delivery", "accepted"]
    },
    {
      "rule": "inventory.has_item",
      "args": ["actor.player", "item.bread_basket"]
    },
    {
      "rule": "flag.is_false",
      "args": ["visited_chapel"]
    }
  ],
  "content_tags": ["chapel", "errand"],
  "text": "小教堂院里，修士接过面包篮，低声说艾尔达总是记得清晨的施舍。",
  "choices": [
    {
      "text": "把这句话记下",
      "effects": [
        {
          "effect": "flag.set",
          "args": ["visited_chapel", true]
        },
        {
          "effect": "inventory.remove_item",
          "args": ["actor.player", "item.bread_basket"]
        },
        {
          "effect": "quest.complete",
          "args": ["quest.bread_delivery"]
        },
        {
          "effect": "social.adjust_trust",
          "args": ["actor.elda", 2]
        }
      ]
    }
  ],
  "cooldown": {},
  "repeat_policy": "once"
}
